,Date,notes,geometry,Place0,Place1,Place2,Place3
842,2016-01-22,"Hundreds of angry pupils and their parents attacked a Limpopo circuit office. Pupils and parents threw stones, broke down the gate, and smashed windows at the local circuit office, forcing employees to flee. No one was injured during the violence.",POINT (29.4689 -23.9045),Limpopo,Capricorn,Polokwane,22
843,2016-01-21,The admissions office at NMMU was temporarily shut down by about 25 students who staged a protest.,POINT (25.5701 -33.918),Eastern Cape,Nelson Mandela Bay,Nelson Mandela Bay,11
844,2016-01-19,"Students and workers protesting at the University of Pretoria (UP), defying a court interdict that ordered them to be at least 150m away from the institution.",POINT (28.1878 -25.7449),Gauteng,City of Tshwane,City of Tshwane,58
845,2016-01-18,"At the University of Pretoria, petrol bombs were thrown at a truck at the university, causing minimal damages. The actions was part of ongoing protests at Universities throughout Pretoria.",POINT (28.1878 -25.7449),Gauteng,City of Tshwane,City of Tshwane,58
846,2016-01-18,Protest action reportedly took place at the Acadia campus of TUTs. These protests are part of ongoing protests led by students and outsourced workers.,POINT (28.2214 -25.7464),Gauteng,City of Tshwane,City of Tshwane,92
847,2016-01-15,Unisa and the University of Pretoria remained closed as protests continued at the two institutions.,POINT (28.1878 -25.7449),Gauteng,City of Tshwane,City of Tshwane,58
848,2016-01-14,"Workers marched through the streets towards the TUT main campus. A cleaner at Protea Hotel had his wheelie bin taken from him and when he protested, he was attacked and chased inside the building. They were ordered to retreat and when they stood their ground, police opened fire, firing rubber bullets and tear gas into the crowd.",POINT (28.1878 -25.7449),Gauteng,City of Tshwane,City of Tshwane,58
849,2016-01-14,The Cape Town Rastafarian community protested outside Woodstock Police Station.,POINT (18.4333 -33.9167),Western Cape,City of Cape Town,City of Cape Town,115
850,2016-01-14,"Community activists and parents at Austerville Primary School, in Wentworth, are calling for the sacking of the newly appointed principal. Protesters first took to the streets on Monday, demonstrating outside the school, and continued on Thursday.",POINT (30.9979 -29.9264),KwaZulu-Natal,eThekwini,eThekwini,66
851,2016-01-14,About 300 students protested outside a campus of the Thekwini College in Durban,POINT (31.0292 -29.8579),KwaZulu-Natal,eThekwini,eThekwini,28
852,2016-01-13,"Parents and community members blockaded the entrance of a school outside Robertson. During the protest, they chained the front gates, preventing any learners or staff from entering the premises.",POINT (19.8854 -33.8034),Western Cape,Cape Winelands,Langeberg,1
853,2016-01-13,Protesting students and outsourced workers at the University of Pretoria (UP) picketed outside campus,POINT (28.1878 -25.7449),Gauteng,City of Tshwane,City of Tshwane,58
854,2016-01-12,"Students and contract workers demonstrated outside the Univeristy in Pretoria and UNISA. However, they were met by aggressive police officers and soon found themselves on the wrong end of stun grenades; three workers sustained minor injuries",POINT (28.1878 -25.7449),Gauteng,City of Tshwane,City of Tshwane,58
855,2016-01-11,"Protesters have shut down the University of South Africas (UNISA) Sunnyside Campus, expressing their dissatisfaction with management.",POINT (28.2167 -25.75),Gauteng,City of Tshwane,City of Tshwane,92
856,2016-01-11,"At the University of Johannesburg, a scene reminiscent of last years protests played out as students and private security guards clashed outside the campus",POINT (28.0436 -26.2023),Gauteng,City of Johannesburg,City of Johannesburg,60
857,2016-01-11,Registration at Wits University was disrupted after students resumed picketing under their #FeesMustFall campaign at the campus.,POINT (28.0219 -26.1982),Gauteng,City of Johannesburg,City of Johannesburg,60
858,2016-01-11,"Community activists and parents at Austerville Primary School, in Wentworth, are calling for the sacking of the newly appointed principal. Protesters first took to the streets on Monday, demonstrating outside the school, and continued on Thursday.",POINT (30.9979 -29.9264),KwaZulu-Natal,eThekwini,eThekwini,66
859,2016-01-11,CPUT students writing exams at Walter Sisulu University (WSU) were forced to stop after students from that institution started protesting for free education.,POINT (28.7844 -31.5889),Eastern Cape,O.R.Tambo,King Sabata Dalindyebo,6
860,2015-12-04,"Students and staff protested at UNISAs Pretoria campus, calling on all council members who have served for more than two terms to step down.",POINT (28.1878 -25.7449),Gauteng,City of Tshwane,City of Tshwane,58
861,2015-11-23,Exams were disrupted at the Bellville Campus after the venue was flooded with water. More than 40 protesting Cape Peninsula University of Technology students were arrested by police yesterday.,POINT (18.6333 -33.9),Western Cape,City of Cape Town,City of Cape Town,10
862,2015-11-21,"During a protest, three halls were set alight at the Tshwane University of Technology's Soshanguve campus. Two private vehicles belonging to security guards were also set alight during the student protest.",POINT (28.0992 -25.4729),Gauteng,City of Tshwane,City of Tshwane,94
863,2015-11-19,A group of about 50 students at TUTS Soshanguve campus disrupted students who were preparing for their examinations scheduled for Friday.,POINT (28.0992 -25.4729),Gauteng,City of Tshwane,City of Tshwane,94
864,2015-11-19,A group of UCT student gathered outside the Wynberg Magistrates Court to support a victim of rape,POINT (18.4 -33.9833),Western Cape,City of Cape Town,City of Cape Town,54
865,2015-11-18,About 50 students marched from their Quigney residence to the institutions East London campus.,POINT (27.9116 -33.0153),Eastern Cape,Buffalo City,Buffalo City,47
866,2015-11-18,Exams could not go ahead as protesters continued to gather at the Soshanguve campus of TUTs.,POINT (28.0992 -25.4729),Gauteng,City of Tshwane,City of Tshwane,94
867,2015-11-17,A stun grenade was fired at a crowd of protesters apparently rattling the gates of the Stellenbosch police station following the arrest of four Stellenbosch University workers on Tuesday.Protesting students set alight bins and other objects.,POINT (18.8668 -33.9346),Western Cape,Cape Winelands,Stellenbosch,8
868,2015-11-17,"Students at TUT university in Pretoria protested at the Soshanguve North and South campuses, demanding all debt be erased. Some went on the rampage torching some of the campus buildings, beating a security guard into a critical state and vandalising campus property",POINT (28.0992 -25.4729),Gauteng,City of Tshwane,City of Tshwane,94
869,2015-11-17,"Workers, joined by some students, have been protesting at NMMU (University) since Sunday.",POINT (25.5701 -33.918),Eastern Cape,Nelson Mandela Bay,Nelson Mandela Bay,11
870,2015-11-16,UCT confirms that a small group of about seven protesters attempted to disrupt an exam this evening at the Sport Centre on Upper Campus.,POINT (18.4764 -33.9633),Western Cape,City of Cape Town,City of Cape Town,58
871,2015-11-16,"Workers, joined by some students, have been protesting at NMMU (University) since Sunday.",POINT (25.5701 -33.918),Eastern Cape,Nelson Mandela Bay,Nelson Mandela Bay,11
872,2015-11-15,"Workers, joined by some students, have been protesting at NMMU (University) since Sunday.",POINT (25.5701 -33.918),Eastern Cape,Nelson Mandela Bay,Nelson Mandela Bay,11
873,2015-11-13,"Scores of protesting Cape Peninsula University of Technology students gathered at the Bellville campus and extensive damage was done to property, forcing police to respond quickly. Stun grenades and rubber bullets were fired and a number of students were arrested.",POINT (18.6333 -33.9),Western Cape,City of Cape Town,City of Cape Town,10
874,2015-11-13,A night vigil at the University of Johannesburgs Kingsway Campus in Auckland Park turned violent on Friday after protesting students tried to get inside the premises of the institution. Police fired rubber bullets forcing the crowd to flee.,POINT (28.0039 -26.1814),Gauteng,City of Johannesburg,City of Johannesburg,87
875,2015-11-11,"Chaos erupted at UWC today as police used rubber bullets, teargas and stun grenades against rioting students who were protesting against the stand taken by the head of the university council.",POINT (18.6333 -33.9),Western Cape,City of Cape Town,City of Cape Town,10
876,2015-11-09,Protesters turned cars away ahead of the court appearance of dozens of students and workers who were arrested on Friday for violating a court order not allowing them to protest at the University of Johannesburg campus.,POINT (28.0436 -26.2023),Gauteng,City of Johannesburg,City of Johannesburg,60
877,2015-11-09,"Students marched to Parliament on Monday to see President Jacob Zuma and Higher Education Minister Blade Nzimande. At the same time, NHAWU aligned workers march outside parliament and start a strike. Simulataneously, about 150 students from iQhayiya High School marched to the Western Cape Department of Education to demand an answer from the acting deputy director, Benjamin Schereka, to their list of demands.",POINT (18.4239 -33.9253),Western Cape,City of Cape Town,City of Cape Town,115
878,2015-11-09,University exams started in Cape Town on Monday shortly after protesting students set tyres alight at a main entrance to Students also throw bottles at the Vice-Chancellor.,POINT (18.4667 -33.9333),Western Cape,City of Cape Town,City of Cape Town,57
879,2015-11-06,"About 200 protesters, including students and academics from Wits University, say they were kneeling a distance away from the UJ perimeter fencing, their hands up in a show of peaceful non-violence. During the protest, they were arrested en masse. Elsewhere on campus petrol bombs were hurled at a computer lab and at a parked car.",POINT (28.0039 -26.1814),Gauteng,City of Johannesburg,City of Johannesburg,87
880,2015-11-05,Police officers watched helplessly as private security guards assaulted and pepper-sprayed protesting University of Johannesburg students and workers yesterday. Protesters later burn debris in protest.,POINT (28.0039 -26.1814),Gauteng,City of Johannesburg,City of Johannesburg,87
881,2015-11-03,"During student protests and riots, a guardhouse was set alight.",POINT (28.0039 -26.1814),Gauteng,City of Johannesburg,City of Johannesburg,87
882,2015-11-02,Students protested at the University of the Western Cape against the use of private security guards to quell unrest on the campus.,POINT (18.4239 -33.9253),Western Cape,City of Cape Town,City of Cape Town,115
883,2015-11-02,About a 100 students and workers from the University of Cape Town held a picket outside of Parliament.,POINT (18.6333 -33.9),Western Cape,City of Cape Town,City of Cape Town,10
884,2015-11-02,"On Monday, students and workers occupied vice-chancellor Ihron Rensburgs office and demanded that he immediately end outsourcing. The group was assaulted by private security guards during their sit-in.",POINT (28.0039 -26.1814),Gauteng,City of Johannesburg,City of Johannesburg,87
885,2015-10-30,Students at University of the Western Cape riot and demand the elimination of student debt and free registration. During the riot university security staff are severely injured.,POINT (18.4239 -33.9253),Western Cape,City of Cape Town,City of Cape Town,115
886,2015-10-29,Police used stun grenade and spray guns to disperse a group of about 300 Walter Sisulu University (WSU) students.,POINT (27.9116 -33.0153),Eastern Cape,Buffalo City,Buffalo City,47
887,2015-10-29,A few hundred students and workers from the University of Cape Town (UCT) marched to parliament this afternoon.,POINT (18.4239 -33.9253),Western Cape,City of Cape Town,City of Cape Town,115
888,2015-10-29,Students continued to protest about many issues at the University of TUTS.,POINT (28.1878 -25.7449),Gauteng,City of Tshwane,City of Tshwane,58
889,2015-10-29,"A group of Wits University students riot, pelt security guards with stones, burn vehicles and attack fellow students returning to lectures. The police are deployed to disperse the students.",POINT (28.0436 -26.2023),Gauteng,City of Johannesburg,City of Johannesburg,60
890,2015-10-29,"University of Western Cape students again shut down campus, and occupied Robert Sobukwe Road in protest against the universities continued lack of engagement with their demands",POINT (18.6333 -33.9),Western Cape,City of Cape Town,City of Cape Town,10
891,2015-10-28,"A group of Wits University students went on the rampage yesterday, pelting security guards with stones, burning vehicles and attacking fellow students returning to classes.",POINT (28.0436 -26.2023),Gauteng,City of Johannesburg,City of Johannesburg,60
892,2015-10-28,High SchoolPupils in Khayelitsha participated in a protest as they refused to write the provincial systemic tests.,POINT (18.6792 -34.0393),Western Cape,City of Cape Town,City of Cape Town,94
893,2015-10-28,University of KwaZulu-Natals Pietermaritzburg campus riot and assault university security guards.,POINT (30.3833 -29.6167),KwaZulu-Natal,Umgungundlovu,The Msunduzi,27
894,2015-10-28,The Mahikeng campus of the North-West University (NWU) was closed yesterday due to student protests.,POINT (25.6367 -25.8556),North West,Ngaka Modiri Molema,Mafikeng,7
895,2015-10-27,Stores are looted and buildings burnt during overnight protests at Wits University.,POINT (28.0436 -26.2023),Gauteng,City of Johannesburg,City of Johannesburg,60
896,2015-10-27,"Hundreds of protesting students marched in Pretoria stoppig at SARS, the SA Reserve Bank and the offices of City Property.",POINT (28.1878 -25.7449),Gauteng,City of Tshwane,City of Tshwane,58
897,2015-10-27,At Cape Town University of Technology students forcible remove staff and students from their offices and classes.,POINT (18.6333 -33.9),Western Cape,City of Cape Town,City of Cape Town,10
898,2015-10-27,"In Rondebosch, UCT workers, supported by students, protest against outsourcing at the university.",POINT (18.4764 -33.9633),Western Cape,City of Cape Town,City of Cape Town,58
899,2015-10-27,University of Western Cape students shut down the campus during a protest over increasing fees. No reports of violence.,POINT (18.6333 -33.9),Western Cape,City of Cape Town,City of Cape Town,10
900,2015-10-27,Students at the University of KwaZulu-Natals (UKZN) Edgewood campus in Pinetown blockade the entrance to the campus with debris before marching to the provincial education department.,POINT (30.8867 -29.8207),KwaZulu-Natal,eThekwini,eThekwini,18
901,2015-10-26,Walter Sisulu University students march and force Fort Hare University students to join them in their march. The protesters demand a cancellation of student debt. During the protest students kick down doors and use fire extinguishers to spray water under doors.,POINT (27.9116 -33.0153),Eastern Cape,Buffalo City,Buffalo City,47
902,2015-10-26,Student protesters burn tyres at Wits University. It is unknown whether the perpetrators were students who wish to end the protest or students who wish to call off the protests to sit exams.,POINT (28.0436 -26.2023),Gauteng,City of Johannesburg,City of Johannesburg,60
903,2015-10-26,"A group of residents burnt a container and tyres on Monday night, wreaking havoc in the township.",POINT (18.3763 -34.1293),Western Cape,City of Cape Town,City of Cape Town,69
904,2015-10-26,Thirteen students were arrested on Monday after students went on the rampage and clashed with police.,POINT (29.4689 -23.9045),Limpopo,Capricorn,Polokwane,22
905,2015-10-26,Stellenbosch students protest outside Stellenbosch court during the trial of three students accused of vandalism.,POINT (18.8668 -33.9346),Western Cape,Cape Winelands,Stellenbosch,8
906,2015-10-26,Students at the University of Limpopo loot shops and burn vehicles during a demonstration demanding the cancellation of all outstanding debt.,POINT (29.7571 -23.89),Limpopo,Capricorn,Polokwane,31
907,2015-10-26,The University of the Western Cape (UWC) became the latest campus to close its doors yesterday after hundreds of students marched across the university grounds.,POINT (18.6333 -33.9),Western Cape,City of Cape Town,City of Cape Town,10
908,2015-10-26,A car is petrol bombed during a protest by UCT students.,POINT (18.4667 -33.9333),Western Cape,City of Cape Town,City of Cape Town,57
909,2015-10-26,Students at Durban-Westville and Howard campuses staged a protest.,POINT (31.0292 -29.8579),KwaZulu-Natal,eThekwini,eThekwini,28
910,2015-10-26,Students at Durban-Westville and Howard campuses staged a protest.,POINT (30.9333 -29.8333),KwaZulu-Natal,eThekwini,eThekwini,30
911,2015-10-26,A student protest took an angry turn at the University of Fort Hare yesterday when hundreds of students broke into and looted a bookstore.,POINT (26.8344 -32.7875),Eastern Cape,Amathole,Raymond Mhlaba,6
912,2015-10-26,Police fired rubber bullets at protesting North-West University students at the Mahikeng Campus yesterday.,POINT (27.1 -26.7167),North West,Dr Kenneth Kaunda,Ventersdorp/Tlokwe,24
913,2015-10-24,A small number of students hold a peaceful protest over fees at North West Universitys Potchefstroom campus.,POINT (27.1 -26.7167),North West,Dr Kenneth Kaunda,Ventersdorp/Tlokwe,24
914,2015-10-23,6000 protesters demonstrate against fees and clash with police.,POINT (18.4239 -33.9253),Western Cape,City of Cape Town,City of Cape Town,115
915,2015-10-23,Thousands of students converge on the African National Congresss regional offices in Durban to protest against increasing university fees.,POINT (31.0292 -29.8579),KwaZulu-Natal,eThekwini,eThekwini,28
916,2015-10-23,A building at the University of Zululand's KwaDlangezwa campus is set alight by suspected student protesters demonstrating over fee hikes.,POINT (31.8411 -28.858),KwaZulu-Natal,Uthungulu,uMhlathuze,30
917,2015-10-22,"Police use water cannons, tear gas and stun grenades to disperse students at University of the Free State in Bloemfontein demonstrating over increasing fees.",POINT (26.2 -29.1333),Free State,Mangaung,Mangaung,24
918,2015-10-22,Security guards at the University of Johannesburg pepper spray students protesting against increasing fees.,POINT (28.0436 -26.2023),Gauteng,City of Johannesburg,City of Johannesburg,60
919,2015-10-22,Students protest outside ANC headquarters against rising costs in education.,POINT (28.0436 -26.2023),Gauteng,City of Johannesburg,City of Johannesburg,60
920,2015-10-22,Students protesting against rising university fees demonstrate outside the higher education department.,POINT (28.1878 -25.7449),Gauteng,City of Tshwane,City of Tshwane,58
921,2015-10-22,Students at the University of Limpopo protest peacefully against increasing university fees.,POINT (29.4689 -23.9045),Limpopo,Capricorn,Polokwane,22
922,2015-10-22,Students at Walter Sisulu University in Alice and East London protest against rising fees and burn tyres before being dispersed by police.,POINT (27.9116 -33.0153),Eastern Cape,Buffalo City,Buffalo City,47
923,2015-10-22,Students at Walter Sisulu University in Butterworth protest over fee increases and erect obsticles on the road. They are escorted back to their dorms by police.,POINT (28.15 -32.3333),Eastern Cape,Amathole,Mnquma,1
924,2015-10-22,Peacefully protesting students are dispersed with stun grenades by police. The students were protesting over rising tuition fees.,POINT (18.4173 -33.9042),Western Cape,City of Cape Town,City of Cape Town,115
925,2015-10-22,students at Durban University of Technology disrupt exams and protest over rising university fees.,POINT (31.0292 -29.8579),KwaZulu-Natal,eThekwini,eThekwini,28
926,2015-10-22,Students march peacefully to the provincial legislature to protest against increasing fees.,POINT (30.3833 -29.6167),KwaZulu-Natal,Umgungundlovu,The Msunduzi,27
927,2015-10-22,Students at Sol Plaatje University throw stones at police who respond with rubber bullets. The students were demonstrating against a proposed 8% increase in fees.,POINT (24.7667 -28.7333),Nothern Cape,Frances Baard,Sol Plaatjie,20
928,2015-10-22,Students at Walter Sisulu University protest against rising fees before being dispersed peacefully by police.,POINT (26.8167 -32.1667),Eastern Cape,Chris Hani,Enoch Mgijima,26
929,2015-10-22,Students at the University of Fort Hare violently clash with police during protests over increasing fees.,POINT (26.8344 -32.7875),Eastern Cape,Amathole,Raymond Mhlaba,6
930,2015-10-21,Students from the University of the Free State peacefully protest and chant against increasing university fees.,POINT (26.2 -29.1333),Free State,Mangaung,Mangaung,24
931,2015-10-21,A collective of students march to the offices of Higher Education Minister Blade Nzimande to hand in a memorandum against rising tuition fees.,POINT (28.1878 -25.7449),Gauteng,City of Tshwane,City of Tshwane,58
932,2015-10-21,Protesting students at Stellenbosch University confront management over increasing tuition fees. There are no reprots of injury of violence.,POINT (18.8668 -33.9346),Western Cape,Cape Winelands,Stellenbosch,8
933,2015-10-21,University of Pretoria students hold a peaceful protest.,POINT (28.2382 -25.7474),Gauteng,City of Tshwane,City of Tshwane,92
934,2015-10-21,Students at the University of Limpopo clash with police and stone vehicles during a protest over increasing fees.,POINT (29.4689 -23.9045),Limpopo,Capricorn,Polokwane,22
935,2015-10-21,Students at the Cape Peninsula University of Technology stone and loot administrative buildings at the universities Bellville campus. The students are demonstrating against increasing fees.,POINT (18.6333 -33.9),Western Cape,City of Cape Town,City of Cape Town,10
936,2015-10-21,Wits students march from Parktown to Braamfontein to protest against rising university fees.,POINT (28.0267 -26.1821),Gauteng,City of Johannesburg,City of Johannesburg,87
937,2015-10-21,Students at Nelson Mandela Metropolitan University burn tyres and riot over increasing fees. Police disperse the rioters with rubber bullets.,POINT (25.5701 -33.918),Eastern Cape,Nelson Mandela Bay,Nelson Mandela Bay,11
938,2015-10-21,Protests against rising fees occur at all of the University of KwaZulu-Natals campuses. The protesters hold talks and sing songs about the governments failure to provide free education.,POINT (31.0292 -29.8579),KwaZulu-Natal,eThekwini,eThekwini,28
939,2015-10-21,Protests against rising fees occur at all of the University of KwaZulu-Natals campuses. The protesters hold talks and sing songs about the governments failure to provide free education.,POINT (30.9808 -29.8675),KwaZulu-Natal,eThekwini,eThekwini,101
940,2015-10-21,Protests against rising fees occur at all of the University of KwaZulu-Natals campuses. The protesters hold talks and sing songs about the governments failure to provide free education.,POINT (30.3833 -29.6167),KwaZulu-Natal,Umgungundlovu,The Msunduzi,27
941,2015-10-21,Protests against rising fees occur at all of the University of KwaZulu-Natals campuses. The protesters hold talks and sing songs about the governments failure to provide free education.,POINT (30.9333 -29.8333),KwaZulu-Natal,eThekwini,eThekwini,30
942,2015-10-21,North-West University loot the cafeteria during a protest.,POINT (25.6367 -25.8556),North West,Ngaka Modiri Molema,Mafikeng,7
943,2015-10-21,Students at Rhodes University continue disruptive protests over university fees.,POINT (26.5328 -33.3042),Eastern Cape,Cacadu,Makana,4
944,2015-10-20,Students at the University of the Free State in Bloemfontein protest against increasing university fees.,POINT (26.2 -29.1333),Free State,Mangaung,Mangaung,24
945,2015-10-20,Students at the Cape Peninsula University of Technology stage a sit-in to protest against a proposed 10% increase in fees. There are reports of vandalism during the demonstration.,POINT (18.4239 -33.9253),Western Cape,City of Cape Town,City of Cape Town,115
946,2015-10-20,Students at Westbury Secondary School protest against insecurity and crime after one of their teachers is killed by local criminals.,POINT (28.0436 -26.2023),Gauteng,City of Johannesburg,City of Johannesburg,60
947,2015-10-20,Police forcibly remove 60 Stellenbosch University students from a building they are occupying as part of a protest against increasing university fees.,POINT (18.8668 -33.9346),Western Cape,Cape Winelands,Stellenbosch,8
948,2015-10-20,Protesting pupils from Matthew Goniwe Memorial School in Khayelitsha vandalise the school and call for the removal of its principal.,POINT (18.6792 -34.0393),Western Cape,City of Cape Town,City of Cape Town,94
949,2015-10-20,"Students at UCT in Rondbosch blockade the road in a protest over fees. Some demonstrators are arrested prompting more demonstrators to go to the police station and demand their release. DA leader Mmusi Maimane attempts to address the protesting students, but is chased away.",POINT (18.4764 -33.9633),Western Cape,City of Cape Town,City of Cape Town,58
950,2015-10-20,Students at Rhodes University erect barricades and clash with police during protests over increasing university fees.,POINT (26.5328 -33.3042),Eastern Cape,Cacadu,Makana,4
951,2015-10-19,Police fire teargas at students occupying and barricading the Bremner Building at the University of Cape Town. The students are protesting over increasing university fees.,POINT (18.4239 -33.9253),Western Cape,City of Cape Town,City of Cape Town,115
952,2015-10-19,"Students at Stellenbosch University form a human chain to bar police from arresting students. Some students stormed the administration building, breaking glass to get in. Riot police were brought in to control the situation",POINT (18.8668 -33.9346),Western Cape,Cape Winelands,Stellenbosch,8
